{
  "actuators": [
    {
      "bias_parameters": [
        0.0,
        -240.0,
        0.0,
        0.0,
        0.0,
        0.0,
        0.0,
        0.0,
        0.0,
        0.0
      ],
      "bias_type": "mjBIAS_AFFINE",
      "control_limited": false,
      "control_range": [
        0.0,
        0.0
      ],
      "dynamics_parameters": [
        1.0,
        0.0,
        0.0,
        0.0,
        0.0,
        0.0,
        0.0,
        0.0,
        0.0,
        0.0
      ],
      "dynamics_type": "mjDYN_NONE",
      "force_limited": true,
      "force_range_N_or_Nm": [
        -180.0,
        180.0
      ],
      "gain_parameters": [
        240.0,
        0.0,
        0.0,
        0.0,
        0.0,
        0.0,
        0.0,
        0.0,
        0.0,
        0.0
      ],
      "gain_type": "mjGAIN_FIXED",
      "gear": [
        1.0,
        0.0,
        0.0,
        0.0,
        0.0,
        0.0
      ],
      "id": 0,
      "length_range": [
        0.0,
        0.0
      ],
      "name": "steer_fl_ctrl",
      "transmission_ids": [
        3,
        -1
      ],
      "transmission_target": "steer_fl_joint",
      "transmission_type": "mjTRN_JOINT"
    },
    {
      "bias_parameters": [
        0.0,
        0.0,
        -32.0,
        0.0,
        0.0,
        0.0,
        0.0,
        0.0,
        0.0,
        0.0
      ],
      "bias_type": "mjBIAS_AFFINE",
      "control_limited": false,
      "control_range": [
        0.0,
        0.0
      ],
      "dynamics_parameters": [
        1.0,
        0.0,
        0.0,
        0.0,
        0.0,
        0.0,
        0.0,
        0.0,
        0.0,
        0.0
      ],
      "dynamics_type": "mjDYN_NONE",
      "force_limited": true,
      "force_range_N_or_Nm": [
        -460.0,
        460.0
      ],
      "gain_parameters": [
        32.0,
        0.0,
        0.0,
        0.0,
        0.0,
        0.0,
        0.0,
        0.0,
        0.0,
        0.0
      ],
      "gain_type": "mjGAIN_FIXED",
      "gear": [
        1.0,
        0.0,
        0.0,
        0.0,
        0.0,
        0.0
      ],
      "id": 1,
      "length_range": [
        0.0,
        0.0
      ],
      "name": "wheel_fl_ctrl",
      "transmission_ids": [
        5,
        -1
      ],
      "transmission_target": "wheel_fl_joint",
      "transmission_type": "mjTRN_JOINT"
    },
    {
      "bias_parameters": [
        0.0,
        -240.0,
        0.0,
        0.0,
        0.0,
        0.0,
        0.0,
        0.0,
        0.0,
        0.0
      ],
      "bias_type": "mjBIAS_AFFINE",
      "control_limited": false,
      "control_range": [
        0.0,
        0.0
      ],
      "dynamics_parameters": [
        1.0,
        0.0,
        0.0,
        0.0,
        0.0,
        0.0,
        0.0,
        0.0,
        0.0,
        0.0
      ],
      "dynamics_type": "mjDYN_NONE",
      "force_limited": true,
      "force_range_N_or_Nm": [
        -180.0,
        180.0
      ],
      "gain_parameters": [
        240.0,
        0.0,
        0.0,
        0.0,
        0.0,
        0.0,
        0.0,
        0.0,
        0.0,
        0.0
      ],
      "gain_type": "mjGAIN_FIXED",
      "gear": [
        1.0,
        0.0,
        0.0,
        0.0,
        0.0,
        0.0
      ],
      "id": 2,
      "length_range": [
        0.0,
        0.0
      ],
      "name": "steer_fr_ctrl",
      "transmission_ids": [
        6,
        -1
      ],
      "transmission_target": "steer_fr_joint",
      "transmission_type": "mjTRN_JOINT"
    },
    {
      "bias_parameters": [
        0.0,
        0.0,
        -32.0,
        0.0,
        0.0,
        0.0,
        0.0,
        0.0,
        0.0,
        0.0
      ],
      "bias_type": "mjBIAS_AFFINE",
      "control_limited": false,
      "control_range": [
        0.0,
        0.0
      ],
      "dynamics_parameters": [
        1.0,
        0.0,
        0.0,
        0.0,
        0.0,
        0.0,
        0.0,
        0.0,
        0.0,
        0.0
      ],
      "dynamics_type": "mjDYN_NONE",
      "force_limited": true,
      "force_range_N_or_Nm": [
        -460.0,
        460.0
      ],
      "gain_parameters": [
        32.0,
        0.0,
        0.0,
        0.0,
        0.0,
        0.0,
        0.0,
        0.0,
        0.0,
        0.0
      ],
      "gain_type": "mjGAIN_FIXED",
      "gear": [
        1.0,
        0.0,
        0.0,
        0.0,
        0.0,
        0.0
      ],
      "id": 3,
      "length_range": [
        0.0,
        0.0
      ],
      "name": "wheel_fr_ctrl",
      "transmission_ids": [
        8,
        -1
      ],
      "transmission_target": "wheel_fr_joint",
      "transmission_type": "mjTRN_JOINT"
    },
    {
      "bias_parameters": [
        0.0,
        -240.0,
        0.0,
        0.0,
        0.0,
        0.0,
        0.0,
        0.0,
        0.0,
        0.0
      ],
      "bias_type": "mjBIAS_AFFINE",
      "control_limited": false,
      "control_range": [
        0.0,
        0.0
      ],
      "dynamics_parameters": [
        1.0,
        0.0,
        0.0,
        0.0,
        0.0,
        0.0,
        0.0,
        0.0,
        0.0,
        0.0
      ],
      "dynamics_type": "mjDYN_NONE",
      "force_limited": true,
      "force_range_N_or_Nm": [
        -180.0,
        180.0
      ],
      "gain_parameters": [
        240.0,
        0.0,
        0.0,
        0.0,
        0.0,
        0.0,
        0.0,
        0.0,
        0.0,
        0.0
      ],
      "gain_type": "mjGAIN_FIXED",
      "gear": [
        1.0,
        0.0,
        0.0,
        0.0,
        0.0,
        0.0
      ],
      "id": 4,
      "length_range": [
        0.0,
        0.0
      ],
      "name": "steer_rl_ctrl",
      "transmission_ids": [
        9,
        -1
      ],
      "transmission_target": "steer_rl_joint",
      "transmission_type": "mjTRN_JOINT"
    },
    {
      "bias_parameters": [
        0.0,
        0.0,
        -32.0,
        0.0,
        0.0,
        0.0,
        0.0,
        0.0,
        0.0,
        0.0
      ],
      "bias_type": "mjBIAS_AFFINE",
      "control_limited": false,
      "control_range": [
        0.0,
        0.0
      ],
      "dynamics_parameters": [
        1.0,
        0.0,
        0.0,
        0.0,
        0.0,
        0.0,
        0.0,
        0.0,
        0.0,
        0.0
      ],
      "dynamics_type": "mjDYN_NONE",
      "force_limited": true,
      "force_range_N_or_Nm": [
        -460.0,
        460.0
      ],
      "gain_parameters": [
        32.0,
        0.0,
        0.0,
        0.0,
        0.0,
        0.0,
        0.0,
        0.0,
        0.0,
        0.0
      ],
      "gain_type": "mjGAIN_FIXED",
      "gear": [
        1.0,
        0.0,
        0.0,
        0.0,
        0.0,
        0.0
      ],
      "id": 5,
      "length_range": [
        0.0,
        0.0
      ],
      "name": "wheel_rl_ctrl",
      "transmission_ids": [
        11,
        -1
      ],
      "transmission_target": "wheel_rl_joint",
      "transmission_type": "mjTRN_JOINT"
    },
    {
      "bias_parameters": [
        0.0,
        -240.0,
        0.0,
        0.0,
        0.0,
        0.0,
        0.0,
        0.0,
        0.0,
        0.0
      ],
      "bias_type": "mjBIAS_AFFINE",
      "control_limited": false,
      "control_range": [
        0.0,
        0.0
      ],
      "dynamics_parameters": [
        1.0,
        0.0,
        0.0,
        0.0,
        0.0,
        0.0,
        0.0,
        0.0,
        0.0,
        0.0
      ],
      "dynamics_type": "mjDYN_NONE",
      "force_limited": true,
      "force_range_N_or_Nm": [
        -180.0,
        180.0
      ],
      "gain_parameters": [
        240.0,
        0.0,
        0.0,
        0.0,
        0.0,
        0.0,
        0.0,
        0.0,
        0.0,
        0.0
      ],
      "gain_type": "mjGAIN_FIXED",
      "gear": [
        1.0,
        0.0,
        0.0,
        0.0,
        0.0,
        0.0
      ],
      "id": 6,
      "length_range": [
        0.0,
        0.0
      ],
      "name": "steer_rr_ctrl",
      "transmission_ids": [
        12,
        -1
      ],
      "transmission_target": "steer_rr_joint",
      "transmission_type": "mjTRN_JOINT"
    },
    {
      "bias_parameters": [
        0.0,
        0.0,
        -32.0,
        0.0,
        0.0,
        0.0,
        0.0,
        0.0,
        0.0,
        0.0
      ],
      "bias_type": "mjBIAS_AFFINE",
      "control_limited": false,
      "control_range": [
        0.0,
        0.0
      ],
      "dynamics_parameters": [
        1.0,
        0.0,
        0.0,
        0.0,
        0.0,
        0.0,
        0.0,
        0.0,
        0.0,
        0.0
      ],
      "dynamics_type": "mjDYN_NONE",
      "force_limited": true,
      "force_range_N_or_Nm": [
        -460.0,
        460.0
      ],
      "gain_parameters": [
        32.0,
        0.0,
        0.0,
        0.0,
        0.0,
        0.0,
        0.0,
        0.0,
        0.0,
        0.0
      ],
      "gain_type": "mjGAIN_FIXED",
      "gear": [
        1.0,
        0.0,
        0.0,
        0.0,
        0.0,
        0.0
      ],
      "id": 7,
      "length_range": [
        0.0,
        0.0
      ],
      "name": "wheel_rr_ctrl",
      "transmission_ids": [
        14,
        -1
      ],
      "transmission_target": "wheel_rr_joint",
      "transmission_type": "mjTRN_JOINT"
    },
    {
      "bias_parameters": [
        0.0,
        0.0,
        0.0,
        0.0,
        0.0,
        0.0,
        0.0,
        0.0,
        0.0,
        0.0
      ],
      "bias_type": "mjBIAS_NONE",
      "control_limited": true,
      "control_range": [
        -2800.0,
        2800.0
      ],
      "dynamics_parameters": [
        1.0,
        0.0,
        0.0,
        0.0,
        0.0,
        0.0,
        0.0,
        0.0,
        0.0,
        0.0
      ],
      "dynamics_type": "mjDYN_NONE",
      "force_limited": true,
      "force_range_N_or_Nm": [
        -2800.0,
        2800.0
      ],
      "gain_parameters": [